[{"id":"phenomena-0001","version":2,"area":"phenomena","subtopic":"double-descent","level":"hard","bloom":"analyze","type":"scenario","format":"single","stability":"stable","difficulty":{"steps":1,"specialization":2,"distractors":1},"prompt":{"en":"As you grow a model, test error rises, peaks right where training error reaches zero, and then falls again as the model keeps growing. What explains the drop beyond that point?","es":"Al agrandar un modelo, el error de test sube, llega a un máximo justo donde el error de entrenamiento llega a cero y luego vuelve a bajar a medida que el modelo sigue creciendo. ¿Qué explica la bajada después de ese punto?"},"options":[{"id":"a","text":{"en":"Many solutions fit the training data, and training tends to find the smoother ones.","es":"Muchas soluciones se ajustan a los datos, y el entrenamiento suele dar con las más suaves."},"rationale":{"en":"Beyond the interpolation threshold there are many interpolating solutions, and gradient-based training is biased toward low-norm, smoother ones, so test error falls again.","es":"Más allá del umbral de interpolación hay muchas soluciones que interpolan, y el entrenamiento por gradiente tiende a las de norma baja, más suaves, así que el error de test vuelve a bajar."}},{"id":"b","text":{"en":"The model starts memorizing the test set through repeated evaluations on it.","es":"El modelo empieza a memorizar el set de test a fuerza de evaluarse una y otra vez en él."},"rationale":{"en":"Evaluating on a test set does not train on it. Repeated model selection can overfit a test set, but that has nothing to do with model size.","es":"Evaluar en el set de test no entrena con él. Seleccionar modelos una y otra vez puede sobreajustar el test, pero eso no depende del tamaño del modelo."}},{"id":"c","text":{"en":"The optimizer stops converging, which acts as a form of early stopping.","es":"El optimizador deja de converger, y eso funciona como una forma de early stopping."},"rationale":{"en":"Training error is zero, so the optimizer has converged on the training data; the drop in test error happens with full convergence.","es":"El error de entrenamiento es cero, así que el optimizador sí convergió sobre los datos de entrenamiento; la bajada del error de test ocurre con convergencia completa."}},{"id":"d","text":{"en":"The extra parameters stay unused, so the model behaves like a smaller one.","es":"Los parámetros extra quedan sin usar, así que el modelo se comporta como uno más chico."},"rationale":{"en":"The extra parameters are used: the solution spreads the fit across them, which keeps the norm small. A smaller model cannot interpolate as smoothly.","es":"Los parámetros extra sí se usan: la solución reparte el ajuste entre ellos, lo que mantiene la norma baja. Un modelo más chico no puede interpolar con tanta suavidad."}}],"answer":["a"],"explanation":{"en":"Belkin et al. showed the double descent curve across several model families, and Nakkiran et al. observed it in deep networks when varying not only model size but also training epochs and the amount of data. The peak is sharper with label noise, and well-tuned regularization can smooth it out. It helps explain why heavily overparameterized models can generalize well.","es":"Belkin et al. mostraron la curva de double descent en varias familias de modelos, y Nakkiran et al. la observaron en redes profundas al variar no solo el tamaño del modelo, sino también las épocas de entrenamiento y la cantidad de datos. El pico es más marcado con ruido en las etiquetas, y una regularización bien ajustada puede suavizarlo. Ayuda a explicar por qué modelos muy sobreparametrizados pueden generalizar bien."},"sources":[{"kind":"paper","title":"Reconciling modern machine learning practice and the bias-variance trade-off","authors":"Mikhail Belkin, Daniel Hsu, Siyuan Ma & Soumik Mandal","year":2019,"url":"https://arxiv.org/abs/1812.11118"},{"kind":"paper","title":"Deep Double Descent: Where Bigger Models and More Data Hurt","authors":"Preetum Nakkiran et al.","year":2019,"url":"https://arxiv.org/abs/1912.02292"}],"tags":["double-descent","overparameterization"],"origin":"llm_draft","reviewed_at":"2026-10-15"}]