[
  {
    "id": "math-0001",
    "version": 2,
    "area": "math",
    "subtopic": "information-theory",
    "level": "easy",
    "bloom": "apply",
    "type": "calculation",
    "format": "single",
    "stability": "stable",
    "difficulty": { "steps": 0, "specialization": 0, "distractors": 1 },
    "prompt": {
      "en": "What is the entropy of a fair eight-sided die, in bits?",
      "es": "¿Cuál es la entropía de un dado justo de ocho caras, medida en bits?"
    },
    "options": [
      {
        "id": "a",
        "text": { "en": "1 bit", "es": "1 bit" },
        "rationale": {
          "en": "That is the entropy of a fair coin, which has two outcomes.",
          "es": "Es la entropía de una moneda justa, que tiene dos resultados."
        }
      },
      {
        "id": "b",
        "text": { "en": "2.08 bits", "es": "2,08 bits" },
        "rationale": {
          "en": "That is ln 8 ≈ 2.08, the entropy in nats. Bits use the base-2 logarithm.",
          "es": "Es ln 8 ≈ 2,08: la entropía en nats. Para bits se usa el logaritmo en base 2."
        }
      },
      {
        "id": "c",
        "text": { "en": "3 bits", "es": "3 bits" },
        "rationale": {
          "en": "With 8 equally likely outcomes, H = log₂ 8 = 3 bits: three yes-or-no questions are enough to identify the face.",
          "es": "Con 8 resultados equiprobables, H = log₂ 8 = 3 bits: bastan tres preguntas de sí o no para identificar la cara."
        }
      },
      {
        "id": "d",
        "text": { "en": "8 bits", "es": "8 bits" },
        "rationale": {
          "en": "This confuses the number of outcomes with the information. Entropy grows with the logarithm of the number of outcomes.",
          "es": "Confunde el número de resultados con la información. La entropía crece con el logaritmo del número de resultados."
        }
      }
    ],
    "keep_order": true,
    "answer": ["c"],
    "explanation": {
      "en": "For a uniform distribution over n outcomes, H = log n, the largest entropy possible with n outcomes. The unit depends on the base of the logarithm: base 2 gives bits and base e gives nats, which is why PyTorch's cross-entropy, computed with the natural log, is in nats.",
      "es": "Para una distribución uniforme sobre n resultados, H = log n, la mayor entropía posible con n resultados. La unidad depende de la base del logaritmo: base 2 da bits y base e da nats. Por eso la cross-entropy de PyTorch, que usa logaritmo natural, viene en nats."
    },
    "sources": [
      { "kind": "book", "title": "Elements of Information Theory (2nd ed.)", "authors": "Thomas M. Cover & Joy A. Thomas", "year": 2006 }
    ],
    "tags": ["entropy", "units"],
    "origin": "llm_draft",
    "reviewed_at": "2026-10-15"
  }
]
