[{"id":"math-0001","version":2,"area":"math","subtopic":"information-theory","level":"easy","bloom":"apply","type":"calculation","format":"single","stability":"stable","difficulty":{"steps":0,"specialization":0,"distractors":1},"prompt":{"en":"What is the entropy of a fair eight-sided die, in bits?","es":"¿Cuál es la entropía de un dado justo de ocho caras, medida en bits?"},"options":[{"id":"a","text":{"en":"1 bit","es":"1 bit"},"rationale":{"en":"That is the entropy of a fair coin, which has two outcomes.","es":"Es la entropía de una moneda justa, que tiene dos resultados."}},{"id":"b","text":{"en":"2.08 bits","es":"2,08 bits"},"rationale":{"en":"That is ln 8 ≈ 2.08, the entropy in nats. Bits use the base-2 logarithm.","es":"Es ln 8 ≈ 2,08: la entropía en nats. Para bits se usa el logaritmo en base 2."}},{"id":"c","text":{"en":"3 bits","es":"3 bits"},"rationale":{"en":"With 8 equally likely outcomes, H = log₂ 8 = 3 bits: three yes-or-no questions are enough to identify the face.","es":"Con 8 resultados equiprobables, H = log₂ 8 = 3 bits: bastan tres preguntas de sí o no para identificar la cara."}},{"id":"d","text":{"en":"8 bits","es":"8 bits"},"rationale":{"en":"This confuses the number of outcomes with the information. Entropy grows with the logarithm of the number of outcomes.","es":"Confunde el número de resultados con la información. La entropía crece con el logaritmo del número de resultados."}}],"keep_order":true,"answer":["c"],"explanation":{"en":"For a uniform distribution over n outcomes, H = log n, the largest entropy possible with n outcomes. The unit depends on the base of the logarithm: base 2 gives bits and base e gives nats, which is why PyTorch's cross-entropy, computed with the natural log, is in nats.","es":"Para una distribución uniforme sobre n resultados, H = log n, la mayor entropía posible con n resultados. La unidad depende de la base del logaritmo: base 2 da bits y base e da nats. Por eso la cross-entropy de PyTorch, que usa logaritmo natural, viene en nats."},"sources":[{"kind":"book","title":"Elements of Information Theory (2nd ed.)","authors":"Thomas M. Cover & Joy A. Thomas","year":2006}],"tags":["entropy","units"],"origin":"llm_draft","reviewed_at":"2026-10-15"},{"id":"math-0002","version":1,"area":"math","subtopic":"matrix-decompositions","level":"medium","bloom":"apply","type":"calculation","format":"single","stability":"stable","difficulty":{"steps":2,"specialization":1,"distractors":1},"prompt":{"en":"The centered data matrix of a dataset has singular values 10, 5, 2 and 1. What fraction of the total variance does the first principal component explain?","es":"La matriz de datos centrada de un dataset tiene valores singulares 10, 5, 2 y 1. ¿Qué fracción de la varianza total explica la primera componente principal?"},"options":[{"id":"a","text":{"en":"25%","es":"25%"},"rationale":{"en":"That would be the share if all four components explained the same variance.","es":"Esa sería la proporción si las cuatro componentes explicaran la misma varianza."}},{"id":"b","text":{"en":"56%","es":"56%"},"rationale":{"en":"This divides the singular values directly: 10/(10 + 5 + 2 + 1). Variance is proportional to the squared singular values.","es":"Esto divide los valores singulares directamente: 10/(10 + 5 + 2 + 1). La varianza es proporcional a los valores singulares al cuadrado."}},{"id":"c","text":{"en":"77%","es":"77%"},"rationale":{"en":"Variance is proportional to the squares: 100/(100 + 25 + 4 + 1) = 100/130 ≈ 0.77.","es":"La varianza es proporcional a los cuadrados: 100/(100 + 25 + 4 + 1) = 100/130 ≈ 0,77."}},{"id":"d","text":{"en":"96%","es":"96%"},"rationale":{"en":"That is the cumulative share of the first two components: (100 + 25)/130.","es":"Esa es la proporción acumulada de las dos primeras componentes: (100 + 25)/130."}}],"keep_order":true,"answer":["c"],"explanation":{"en":"PCA can be computed from the SVD of the centered data, X = UΣVᵀ: the right singular vectors are the principal directions, and the variance along each one is σᵢ²/(n − 1). Because of the squares, a few large singular values usually dominate, which is why a handful of components often captures most of the variance.","es":"El PCA se puede calcular a partir de la SVD de los datos centrados, X = UΣVᵀ: los vectores singulares derechos son las direcciones principales, y la varianza a lo largo de cada una es σᵢ²/(n − 1). Por los cuadrados, unos pocos valores singulares grandes suelen dominar, y por eso un puñado de componentes muchas veces captura la mayor parte de la varianza."},"sources":[{"kind":"book","title":"The Elements of Statistical Learning (2nd ed.)","authors":"Trevor Hastie, Robert Tibshirani & Jerome Friedman","year":2009},{"kind":"book","title":"Principal Component Analysis (2nd ed.)","authors":"Ian T. Jolliffe","year":2002}],"tags":["pca","svd","variance"],"origin":"llm_draft","reviewed_at":"2026-10-16"}]