[{"id":"rl-0001","version":2,"area":"rl","subtopic":"td-q-learning","level":"medium","bloom":"understand","type":"concept","format":"single","stability":"stable","difficulty":{"steps":1,"specialization":1,"distractors":2},"prompt":{"en":"Why is Q-learning called an off-policy algorithm?","es":"¿Por qué se dice que Q-learning es un algoritmo off-policy?"},"options":[{"id":"a","text":{"en":"Its update uses the value of the best next action, whatever action the exploring policy takes.","es":"Actualiza con el valor de la mejor acción siguiente, sea cual sea la que toma la política que explora."},"rationale":{"en":"It learns the value of the greedy policy while acting with another one, such as ε-greedy.","es":"Aprende el valor de la política greedy mientras actúa con otra, por ejemplo ε-greedy."}},{"id":"b","text":{"en":"Its update uses the value of the action that the exploring policy actually takes next.","es":"Actualiza con el valor de la acción que la política que explora toma de verdad a continuación."},"rationale":{"en":"That is SARSA's update, which is on-policy: it learns the value of the policy it actually follows.","es":"Esa es la actualización de SARSA, que es on-policy: aprende el valor de la política que efectivamente sigue."}},{"id":"c","text":{"en":"It learns only from a fixed dataset, without interacting with the environment at all.","es":"Aprende solo a partir de un dataset fijo, sin interactuar en ningún momento con el entorno."},"rationale":{"en":"That describes offline RL. Q-learning can learn online; being off-policy is what also lets it reuse old experience.","es":"Eso describe el RL offline. Q-learning puede aprender en línea; ser off-policy es lo que además le permite reutilizar experiencia antigua."}},{"id":"d","text":{"en":"It learns a model of the environment and plans with it instead of acting directly.","es":"Aprende un modelo del entorno y planifica con ese modelo en lugar de actuar directamente."},"rationale":{"en":"That describes model-based RL. Q-learning is model-free: it learns action values directly from experience.","es":"Eso describe el RL basado en modelos. Q-learning no usa un modelo del entorno: aprende los valores de las acciones directamente de la experiencia."}}],"answer":["a"],"explanation":{"en":"The update is Q(s,a) ← Q(s,a) + α[r + γ·maxₐ′ Q(s′,a′) − Q(s,a)]. SARSA instead uses Q(s′,a′) for the action the policy actually took, so it is on-policy. Being off-policy lets Q-learning learn from experience generated by another policy, as DQN does with its replay buffer.","es":"La actualización es Q(s,a) ← Q(s,a) + α[r + γ·maxₐ′ Q(s′,a′) − Q(s,a)]. SARSA, en cambio, usa Q(s′,a′) de la acción que efectivamente tomó la política, así que es on-policy. Ser off-policy le permite a Q-learning aprender de experiencia generada por otra política, como el replay buffer de DQN."},"sources":[{"kind":"book","title":"Reinforcement Learning: An Introduction (2nd ed.)","authors":"Richard S. Sutton & Andrew G. Barto","year":2018},{"kind":"paper","title":"Q-learning","authors":"Christopher J. C. H. Watkins & Peter Dayan","year":1992}],"tags":["q-learning","off-policy"],"origin":"llm_draft","reviewed_at":"2026-10-15"}]