[
  {
    "id": "classical-ml-0001",
    "version": 2,
    "area": "classical-ml",
    "subtopic": "ensembles",
    "level": "easy",
    "bloom": "understand",
    "type": "concept",
    "format": "single",
    "stability": "stable",
    "difficulty": { "steps": 0, "specialization": 0, "distractors": 1 },
    "prompt": {
      "en": "What is the fundamental difference between bagging (as in random forests) and boosting (as in gradient boosting)?",
      "es": "¿Cuál es la diferencia de fondo entre bagging (como en random forest) y boosting (como en gradient boosting)?"
    },
    "options": [
      {
        "id": "a",
        "text": {
          "en": "Bagging trains models independently and averages them; boosting trains them in sequence, each on the remaining error.",
          "es": "Bagging entrena modelos independientes y los promedia; boosting los entrena en secuencia, sobre el error que queda."
        },
        "rationale": {
          "en": "Averaging many weakly correlated models mainly lowers variance; adding models that target the remaining error mainly lowers bias.",
          "es": "Promediar muchos modelos poco correlacionados reduce sobre todo la varianza; sumar modelos que atacan el error restante reduce sobre todo el sesgo."
        }
      },
      {
        "id": "b",
        "text": {
          "en": "Bagging fits each model on a disjoint subset of the features; boosting fits every model on all of the features.",
          "es": "Bagging entrena cada modelo con un subconjunto disjunto de variables; boosting usa todas las variables en cada modelo."
        },
        "rationale": {
          "en": "Bagging resamples rows with replacement. Random forests also pick a random subset of features at each split, but those subsets overlap.",
          "es": "Bagging remuestrea filas con reemplazo. Random forest además elige un subconjunto aleatorio de variables en cada corte, pero esos subconjuntos se traslapan."
        }
      },
      {
        "id": "c",
        "text": {
          "en": "Bagging averages its models to lower their bias; boosting combines its models to lower their variance.",
          "es": "Bagging promedia sus modelos para reducir el sesgo; boosting los combina para reducir la varianza."
        },
        "rationale": {
          "en": "It is the other way around: averaging independent models mainly lowers variance, while boosting mainly lowers bias.",
          "es": "Es al revés: promediar modelos independientes reduce sobre todo la varianza, y boosting reduce sobre todo el sesgo."
        }
      },
      {
        "id": "d",
        "text": {
          "en": "Both fit their models in sequence; they differ only in how the final predictions are weighted.",
          "es": "Ambos entrenan sus modelos en secuencia y solo difieren en cómo ponderan las predicciones finales."
        },
        "rationale": {
          "en": "Only boosting is sequential. Bagged models are independent of each other, so they can be trained in parallel.",
          "es": "Solo boosting es secuencial. Los modelos de bagging son independientes entre sí, así que se pueden entrenar en paralelo."
        }
      }
    ],
    "answer": ["a"],
    "explanation": {
      "en": "In a random forest, each tree sees a bootstrap sample and a random subset of features at each split, which decorrelates the trees; averaging them lowers variance. In gradient boosting, each new tree fits the negative gradient of the current ensemble's loss (the residuals, for squared error), so order matters, and adding trees without regularization ends in overfitting.",
      "es": "En random forest, cada árbol ve una muestra bootstrap y un subconjunto aleatorio de variables en cada corte, lo que decorrelaciona los árboles; promediarlos baja la varianza. En gradient boosting, cada árbol nuevo se ajusta al gradiente negativo de la pérdida del ensemble actual (con error cuadrático, a los residuos), así que el orden importa y agregar árboles sin regularizar termina en overfitting."
    },
    "sources": [
      { "kind": "paper", "title": "Random Forests", "authors": "Leo Breiman", "year": 2001 },
      { "kind": "paper", "title": "Greedy Function Approximation: A Gradient Boosting Machine", "authors": "Jerome H. Friedman", "year": 2001 }
    ],
    "tags": ["random-forest", "gradient-boosting"],
    "origin": "llm_draft",
    "reviewed_at": "2026-10-15"
  }
]
