[{"id":"responsible-0001","version":2,"area":"responsible","subtopic":"interpretability","level":"medium","bloom":"understand","type":"concept","format":"single","stability":"stable","difficulty":{"steps":0,"specialization":1,"distractors":2},"prompt":{"en":"In your churn model, one feature has the largest mean absolute SHAP value. What does that tell you?","es":"En tu modelo de churn, una variable tiene el mayor valor SHAP absoluto promedio. ¿Qué te dice eso?"},"options":[{"id":"a","text":{"en":"It is the feature that contributes most, on average, to the model's predictions.","es":"Es la variable que más contribuye, en promedio, a las predicciones del modelo."},"rationale":{"en":"SHAP values split each prediction's difference from the average prediction among the features. They measure importance to the model, not effect in the world.","es":"Los valores SHAP reparten entre las variables la diferencia entre cada predicción y la predicción promedio. Miden importancia para el modelo, no efecto en el mundo."}},{"id":"b","text":{"en":"It is the feature that causes customers to leave, so changing it would reduce churn.","es":"Es la variable que causa que los clientes se vayan, así que cambiarla reduciría el churn."},"rationale":{"en":"SHAP explains the model, not the world. A feature correlated with the real cause can take the credit.","es":"SHAP explica el modelo, no el mundo. Una variable correlacionada con la causa real puede llevarse la atribución."}},{"id":"c","text":{"en":"It is the feature most strongly correlated with churn in the training data.","es":"Es la variable más correlacionada con el churn en los datos de entrenamiento."},"rationale":{"en":"A feature can be strongly correlated with churn and still get little attribution if the model relies on a correlated substitute.","es":"Una variable puede estar muy correlacionada con el churn y recibir poca atribución si el modelo usa un sustituto correlacionado."}},{"id":"d","text":{"en":"It is the feature whose removal would cause the largest drop in accuracy.","es":"Es la variable cuya eliminación produciría la mayor caída de accuracy."},"rationale":{"en":"Retraining without the feature can cost little when correlated features take over its role. SHAP describes the current model, not a retrained one.","es":"Reentrenar sin la variable puede costar poco si otras variables correlacionadas toman su papel. SHAP describe el modelo actual, no uno reentrenado."}}],"answer":["a"],"explanation":{"en":"SHAP applies Shapley values from game theory: each feature gets its average marginal contribution over all possible combinations of features. A dominant feature does deserve a look, because it sometimes reveals data leakage (for example, a column filled in after the customer leaves). Causal conclusions need a different design: experiments or causal inference.","es":"SHAP aplica los valores de Shapley de la teoría de juegos: cada variable recibe su contribución marginal promedio sobre todas las combinaciones posibles de variables. Una variable que domina sí merece revisión, porque a veces delata data leakage (por ejemplo, una columna que se llena después de que el cliente se va). Para conclusiones causales hace falta otro diseño: experimentos o inferencia causal."},"sources":[{"kind":"paper","title":"A Unified Approach to Interpreting Model Predictions","authors":"Scott M. Lundberg & Su-In Lee","year":2017,"url":"https://arxiv.org/abs/1705.07874"}],"tags":["shap","causality","leakage"],"origin":"llm_draft","reviewed_at":"2026-10-15"}]