[
  {
    "id": "probabilistic-0001",
    "version": 2,
    "area": "probabilistic",
    "subtopic": "bayesian-inference",
    "level": "medium",
    "bloom": "understand",
    "type": "concept",
    "format": "single",
    "stability": "stable",
    "difficulty": { "steps": 1, "specialization": 1, "distractors": 2 },
    "prompt": {
      "en": "In linear regression, what is equivalent to placing a zero-mean Gaussian prior on the weights and taking the MAP estimate?",
      "es": "En regresión lineal, ¿a qué equivale poner un prior gaussiano de media cero sobre los pesos y quedarse con el estimador MAP?"
    },
    "options": [
      {
        "id": "a",
        "text": { "en": "L2 regularization (ridge regression)", "es": "Regularización L2 (regresión ridge)" },
        "rationale": {
          "en": "The log of the Gaussian prior is −‖w‖²/(2τ²) plus a constant, so maximizing the posterior means minimizing the squared error plus λ‖w‖².",
          "es": "El log del prior gaussiano es −‖w‖²/(2τ²) más una constante, así que maximizar el posterior es minimizar el error cuadrático más λ‖w‖²."
        }
      },
      {
        "id": "b",
        "text": { "en": "L1 regularization (lasso regression)", "es": "Regularización L1 (regresión lasso)" },
        "rationale": {
          "en": "L1 corresponds to a Laplace prior, whose log is proportional to −|w|.",
          "es": "L1 corresponde a un prior de Laplace, cuyo log es proporcional a −|w|."
        }
      },
      {
        "id": "c",
        "text": { "en": "Ordinary least squares, with no penalty", "es": "Mínimos cuadrados, sin penalización" },
        "rationale": {
          "en": "That corresponds to maximum likelihood, or to a flat prior.",
          "es": "Eso corresponde a máxima verosimilitud, o a un prior plano."
        }
      },
      {
        "id": "d",
        "text": { "en": "Dropout applied to the input features", "es": "Dropout aplicado a las variables de entrada" },
        "rationale": {
          "en": "Dropout has approximate Bayesian interpretations, but it is not equivalent to a Gaussian prior with MAP.",
          "es": "Dropout tiene interpretaciones bayesianas aproximadas, pero no equivale a un prior gaussiano con MAP."
        }
      }
    ],
    "answer": ["a"],
    "explanation": {
      "en": "With Gaussian noise of variance σ² and a prior w ~ N(0, τ²I), the MAP estimate minimizes ‖y − Xw‖² + (σ²/τ²)‖w‖²: ridge with λ = σ²/τ². A narrower prior (small τ) means more regularization. A full Bayesian treatment keeps the whole posterior instead of its mode, which gives uncertainty on the predictions.",
      "es": "Con ruido gaussiano de varianza σ² y prior w ~ N(0, τ²I), el MAP minimiza ‖y − Xw‖² + (σ²/τ²)‖w‖²: es ridge con λ = σ²/τ². Un prior más angosto (τ pequeño) significa más regularización. El enfoque bayesiano completo no se queda con la moda, sino con el posterior entero, y eso entrega incertidumbre sobre las predicciones."
    },
    "sources": [
      { "kind": "book", "title": "Pattern Recognition and Machine Learning", "authors": "Christopher M. Bishop", "year": 2006 }
    ],
    "tags": ["map", "ridge", "priors"],
    "origin": "llm_draft",
    "reviewed_at": "2026-10-15"
  },
  {
    "id": "probabilistic-0002",
    "version": 2,
    "area": "probabilistic",
    "subtopic": "conformal",
    "level": "hard",
    "bloom": "analyze",
    "type": "evidence",
    "format": "single",
    "stability": "stable",
    "difficulty": { "steps": 1, "specialization": 2, "distractors": 2 },
    "prompt": {
      "en": "You calibrate split conformal prediction for 90% coverage on one period and apply it, without recalibrating, to data from a later period. The reported interval width does not change. What can you conclude about coverage on the later period?",
      "es": "Calibras conformal prediction al 90% de cobertura con datos de un periodo y la aplicas, sin recalibrar, a datos de un periodo posterior. El ancho reportado de los intervalos no cambia. ¿Qué puedes concluir sobre la cobertura en el periodo posterior?"
    },
    "options": [
      {
        "id": "a",
        "text": {
          "en": "Nothing yet, because the width comes from the calibration set and cannot react to the new data.",
          "es": "Nada todavía, porque el ancho sale del conjunto de calibración y no puede reaccionar a los datos nuevos."
        },
        "rationale": {
          "en": "The width is computed from calibration residuals and never sees the new data, so a stable width says nothing about whether the guarantee still holds.",
          "es": "El ancho se calcula con los residuos de calibración y nunca ve los datos nuevos, así que un ancho estable no dice si la garantía sigue valiendo."
        }
      },
      {
        "id": "b",
        "text": {
          "en": "It stays near 90%, because conformal prediction makes no assumption about the data distribution.",
          "es": "Que sigue cerca del 90%, porque conformal prediction no hace supuestos sobre la distribución de los datos."
        },
        "rationale": {
          "en": "The guarantee needs no particular distribution, but it does require calibration and new data to be exchangeable. Dataset shift breaks that.",
          "es": "La garantía no necesita una distribución particular, pero sí que calibración y datos nuevos sean intercambiables. El dataset shift rompe eso."
        }
      },
      {
        "id": "c",
        "text": {
          "en": "It went up, because intervals that kept their width now cover more of the new data points.",
          "es": "Que subió, porque los intervalos que mantuvieron su ancho ahora cubren más de los datos nuevos."
        },
        "rationale": {
          "en": "An unchanged width says nothing about coverage, which depends on where the new outcomes fall relative to the predictions.",
          "es": "Que el ancho no cambie no dice nada de la cobertura, que depende de dónde caen los resultados nuevos respecto de las predicciones."
        }
      },
      {
        "id": "d",
        "text": {
          "en": "It stays near 90% as long as the input features keep a similar distribution to calibration.",
          "es": "Que sigue cerca del 90%, mientras las variables de entrada mantengan una distribución parecida."
        },
        "rationale": {
          "en": "If the relationship between inputs and target shifts, coverage can collapse even when the inputs look the same.",
          "es": "Si cambia la relación entre las entradas y el objetivo, la cobertura puede desplomarse aunque las entradas se vean iguales."
        }
      }
    ],
    "answer": ["a"],
    "explanation": {
      "en": "Split conformal prediction guarantees at least 1−α coverage in finite samples, with no assumptions about the distribution, as long as the data are exchangeable. In an experiment with New York taxi trips, intervals calibrated on June 2024 that promised 90% covered only 15% of June 2019 trips, with the same reported width: what changed was the price of a ride given its features (concept shift), not the features. Recalibrating with 2,000 labeled trips from the new month restored 90%. If only P(x) shifts and the density ratio can be estimated, a weighted version of conformal prediction exists.",
      "es": "Split conformal garantiza una cobertura de al menos 1−α en muestras finitas, sin supuestos sobre la distribución, siempre que los datos sean intercambiables. En un experimento con viajes de taxi de Nueva York, intervalos calibrados en junio de 2024 que prometían 90% cubrieron solo el 15% de los viajes de junio de 2019, con el mismo ancho reportado: cambió el precio de los viajes respecto de sus características (concept shift), no las características. Recalibrar con 2.000 viajes etiquetados del mes nuevo restauró el 90%. Si solo cambia P(x) y se puede estimar la razón de densidades, existe una versión ponderada de conformal."
    },
    "sources": [
      {
        "kind": "paper",
        "title": "A Gentle Introduction to Conformal Prediction and Distribution-Free Uncertainty Quantification",
        "authors": "Anastasios N. Angelopoulos & Stephen Bates",
        "year": 2021,
        "url": "https://arxiv.org/abs/2107.07511"
      },
      {
        "kind": "paper",
        "title": "Conformal Prediction Under Covariate Shift",
        "authors": "Ryan J. Tibshirani, Rina Foygel Barber, Emmanuel J. Candès & Aaditya Ramdas",
        "year": 2019,
        "url": "https://arxiv.org/abs/1904.06019"
      },
      {
        "kind": "experiment",
        "title": "conformal-under-drift",
        "authors": "Cristobal Santana",
        "year": 2026,
        "url": "https://github.com/CristobalSantana/ml-toy-experiments/tree/main/experiments/conformal-under-drift"
      }
    ],
    "tags": ["conformal", "dataset-shift", "silent-failure"],
    "collection": "strange-machines",
    "origin": "llm_draft",
    "reviewed_at": "2026-10-15"
  }
]
