[
  {
    "id": "rl-0001",
    "version": 3,
    "area": "rl",
    "subtopic": "td-q-learning",
    "level": "medium",
    "bloom": "understand",
    "type": "concept",
    "format": "single",
    "stability": "stable",
    "difficulty": { "steps": 1, "specialization": 1, "distractors": 2 },
    "prompt": {
      "en": "Why is Q-learning called an off-policy algorithm?",
      "es": "¿Por qué se dice que Q-learning es un algoritmo off-policy?"
    },
    "options": [
      {
        "id": "a",
        "text": {
          "en": "Its update uses the value of the best next action, whatever action the exploring policy takes.",
          "es": "Actualiza con el valor de la mejor acción siguiente, sea cual sea la que toma la política que explora."
        },
        "rationale": {
          "en": "It learns the value of the greedy policy while acting with another one, such as ε-greedy.",
          "es": "Aprende el valor de la política greedy mientras actúa con otra, por ejemplo ε-greedy."
        }
      },
      {
        "id": "b",
        "text": {
          "en": "Its update uses the value of the action that the exploring policy actually takes at the next step.",
          "es": "Actualiza con el valor de la acción que la política que explora efectivamente toma en el paso siguiente."
        },
        "rationale": {
          "en": "That is SARSA's update, which is on-policy: it learns the value of the policy it actually follows.",
          "es": "Esa es la actualización de SARSA, que es on-policy: aprende el valor de la política que efectivamente sigue."
        }
      },
      {
        "id": "c",
        "text": {
          "en": "It learns only from a fixed dataset, without interacting with the environment at all.",
          "es": "Aprende solo a partir de un dataset fijo, sin interactuar en ningún momento con el entorno."
        },
        "rationale": {
          "en": "That describes offline RL. Q-learning can learn online; being off-policy is what also lets it reuse old experience.",
          "es": "Eso describe el RL offline. Q-learning puede aprender en línea; ser off-policy es lo que además le permite reutilizar experiencia antigua."
        }
      },
      {
        "id": "d",
        "text": {
          "en": "It learns a model of the environment and plans with it instead of acting directly.",
          "es": "Aprende un modelo del entorno y planifica con ese modelo en lugar de actuar directamente."
        },
        "rationale": {
          "en": "That describes model-based RL. Q-learning is model-free: it learns action values directly from experience.",
          "es": "Eso describe el RL basado en modelos. Q-learning no usa un modelo del entorno: aprende los valores de las acciones directamente de la experiencia."
        }
      }
    ],
    "answer": ["a"],
    "explanation": {
      "en": "The update is Q(s,a) ← Q(s,a) + α[r + γ·maxₐ′ Q(s′,a′) − Q(s,a)]. SARSA instead uses Q(s′,a′) for the action the policy actually took, so it is on-policy. Being off-policy lets Q-learning learn from experience generated by another policy, as DQN does with its replay buffer.",
      "es": "La actualización es Q(s,a) ← Q(s,a) + α[r + γ·maxₐ′ Q(s′,a′) − Q(s,a)]. SARSA, en cambio, usa Q(s′,a′) de la acción que efectivamente tomó la política, así que es on-policy. Ser off-policy le permite a Q-learning aprender de experiencia generada por otra política, como el replay buffer de DQN."
    },
    "sources": [
      { "kind": "book", "title": "Reinforcement Learning: An Introduction (2nd ed.)", "authors": "Richard S. Sutton & Andrew G. Barto", "year": 2018 },
      { "kind": "paper", "title": "Q-learning", "authors": "Christopher J. C. H. Watkins & Peter Dayan", "year": 1992 }
    ],
    "tags": ["q-learning", "off-policy"],
    "origin": "llm_draft",
    "reviewed_at": "2026-10-15"
  },
  {
    "id": "rl-0002",
    "version": 1,
    "area": "rl",
    "subtopic": "exploration",
    "level": "easy",
    "bloom": "understand",
    "type": "concept",
    "format": "single",
    "stability": "stable",
    "difficulty": { "steps": 0, "specialization": 0, "distractors": 1 },
    "prompt": {
      "en": "In ε-greedy exploration with ε = 0.1, how does the agent choose an action?",
      "es": "En exploración ε-greedy con ε = 0,1, ¿cómo elige el agente una acción?"
    },
    "options": [
      {
        "id": "a",
        "text": {
          "en": "With probability 0.9 it takes the best-valued action, and with 0.1 a random one.",
          "es": "Con probabilidad 0,9 toma la acción mejor valorada, y con 0,1 una al azar."
        },
        "rationale": {
          "en": "ε is the probability of exploring. Most of the time the agent exploits its current estimates, and sometimes it tries something else so it can discover better actions.",
          "es": "ε es la probabilidad de explorar. La mayor parte del tiempo el agente aprovecha sus estimaciones actuales, y a veces prueba otra cosa para poder descubrir mejores acciones."
        }
      },
      {
        "id": "b",
        "text": {
          "en": "With probability 0.1 it takes the best action, and with 0.9 a random action.",
          "es": "Con probabilidad 0,1 toma la mejor acción, y con 0,9 una acción al azar."
        },
        "rationale": {
          "en": "That swaps the roles: ε is the probability of exploring, so a small ε means mostly greedy behavior.",
          "es": "Eso invierte los papeles: ε es la probabilidad de explorar, así que un ε pequeño significa un comportamiento mayormente greedy."
        }
      },
      {
        "id": "c",
        "text": {
          "en": "It picks each action with probability proportional to its estimated value.",
          "es": "Elige cada acción con probabilidad proporcional a su valor estimado."
        },
        "rationale": {
          "en": "Sampling according to values, usually through a softmax, is Boltzmann exploration, a different strategy.",
          "es": "Muestrear según los valores, normalmente con un softmax, es exploración de Boltzmann, otra estrategia."
        }
      },
      {
        "id": "d",
        "text": {
          "en": "It explores during the first 10% of training and then takes the best action.",
          "es": "Explora durante el primer 10% del entrenamiento y después toma la mejor acción."
        },
        "rationale": {
          "en": "ε-greedy explores at every step with probability ε; schedules that lower ε over time are common, but they still apply step by step.",
          "es": "ε-greedy explora en cada paso con probabilidad ε; es común que ε baje con el tiempo, pero igual se aplica paso a paso."
        }
      }
    ],
    "answer": ["a"],
    "explanation": {
      "en": "Many implementations decay ε from about 1 toward a small value during training: early on the estimates are poor and exploring is cheap, and later exploiting pays more. DQN used this kind of schedule, annealing ε from 1.0 to 0.1 over the first million frames.",
      "es": "Muchas implementaciones bajan ε desde cerca de 1 hasta un valor pequeño durante el entrenamiento: al principio las estimaciones son malas y explorar sale barato, y más adelante conviene más aprovechar. DQN usó este tipo de calendario, bajando ε de 1,0 a 0,1 durante el primer millón de frames."
    },
    "sources": [
      { "kind": "book", "title": "Reinforcement Learning: An Introduction (2nd ed.)", "authors": "Richard S. Sutton & Andrew G. Barto", "year": 2018 },
      { "kind": "paper", "title": "Human-level control through deep reinforcement learning", "authors": "Volodymyr Mnih et al.", "year": 2015 }
    ],
    "tags": ["exploration", "epsilon-greedy", "rl"],
    "origin": "llm_draft",
    "reviewed_at": "2026-10-16"
  }
]
