[{"id":"deep-learning-0001","version":2,"area":"deep-learning","subtopic":"residual-connections","level":"easy","bloom":"understand","type":"concept","format":"single","stability":"stable","difficulty":{"steps":0,"specialization":0,"distractors":1},"prompt":{"en":"What problem did ResNet's residual connections solve?","es":"¿Qué problema resolvieron las conexiones residuales de ResNet?"},"options":[{"id":"a","text":{"en":"Deeper networks reached higher training error, and the shortcut let each block learn a correction to the identity.","es":"Las redes más profundas llegaban a más error de entrenamiento, y el atajo permitió que cada bloque aprendiera una corrección a la identidad."},"rationale":{"en":"He et al. saw deeper plain networks reach higher training error than shallower ones. With y = F(x) + x, a block that adds nothing can stay close to the identity, and gradients flow through the shortcut.","es":"He et al. vieron que redes planas más profundas llegaban a más error de entrenamiento que otras menos profundas. Con y = F(x) + x, un bloque que no aporta puede quedarse cerca de la identidad, y el gradiente fluye por el atajo."}},{"id":"b","text":{"en":"Deeper networks overfit their training data, and the shortcut acted as a regularizer that limited their capacity.","es":"Las redes más profundas sobreajustaban los datos de entrenamiento, y el atajo actuó como un regularizador que limitó su capacidad."},"rationale":{"en":"The problem was higher training error, which overfitting does not explain, and an identity shortcut adds no constraint on capacity.","es":"El problema era más error de entrenamiento, algo que el overfitting no explica, y un atajo de identidad no restringe la capacidad."}},{"id":"c","text":{"en":"Deeper networks were slow at inference, and the shortcut let the network skip the blocks it did not need.","es":"Las redes más profundas eran lentas en inferencia, y el atajo permitió saltarse los bloques que no hacían falta."},"rationale":{"en":"Every block still runs at inference. The shortcut adds the block's input to its output; it does not skip the block.","es":"Todos los bloques se siguen ejecutando en inferencia. El atajo suma la entrada del bloque a su salida; no se salta el bloque."}},{"id":"d","text":{"en":"Deeper networks needed too much memory, and the shortcut let them reuse activations instead of storing new ones.","es":"Las redes más profundas usaban demasiada memoria, y el atajo permitió reutilizar activaciones en vez de guardar otras nuevas."},"rationale":{"en":"Residual connections do not save memory: the block's input has to be kept so it can be added to the output.","es":"Las conexiones residuales no ahorran memoria: la entrada del bloque hay que guardarla para sumarla a la salida."}}],"answer":["a"],"explanation":{"en":"He et al. called it the degradation problem: adding layers to an already deep network raised training error, which overfitting cannot explain. Rewriting each block as y = F(x) + x means the network only has to learn the residual F(x). Residual shortcuts are now in almost every deep architecture, transformers included.","es":"He et al. lo llamaron el problema de degradación: agregar capas a una red ya profunda subía el error de entrenamiento, algo que el overfitting no explica. Al reescribir cada bloque como y = F(x) + x, la red solo tiene que aprender el residuo F(x). Hoy los atajos residuales están en casi todas las arquitecturas profundas, transformers incluidos."},"sources":[{"kind":"paper","title":"Deep Residual Learning for Image Recognition","authors":"Kaiming He, Xiangyu Zhang, Shaoqing Ren & Jian Sun","year":2015,"url":"https://arxiv.org/abs/1512.03385"}],"tags":["resnet","optimization"],"origin":"llm_draft","reviewed_at":"2026-10-15"}]